{
  "schema_version": "0.1",
  "event_id": "evt-occupancy-001",
  "source_agent": "home-sensor",
  "event_type": "occupancy_changed",
  "occurred_at": "2026-09-22T10:00:00.000Z",
  "received_at": "2026-09-22T10:00:00.100Z",
  "privacy_level": "family",
  "data_level": "L0",
  "trace_id": "trace-energy-001",
  "payload": {
    "area": "living_room",
    "occupied": false,
    "observed_for_ms": 600000
  }
}
